Course Name	Link	Coupon
CSS Crash Course For Beginners	https://www.udemy.com/css-crash-course-for-beginners-g/?couponCode=046371A93302C09D0BAE	046371A93302C09D0BAE
Meta Advertising Fundamentals: Facebook Ads & Instagram Ads	https://www.udemy.com/facebook-page-2022/?couponCode=RABBITJUNE2	RABBITJUNE2
Social Messaging Apps For Marketers! Sell More With Apps	https://www.udemy.com/social-messaging-apps-for-marketers-sell-more-with-apps/?couponCode=999JUNE20232	999JUNE20232
Zoom For Business | How To Grow Your Business With Zoom	https://www.udemy.com/zoom-for-business-how-to-grow-your-business-with-zoom/?couponCode=999JUNE20232	999JUNE20232
Podcast For Business | How To Grow A Business With Podcast	https://www.udemy.com/podcast-for-business-how-to-grow-a-business-with-podcast/?couponCode=999JUNE20232	999JUNE20232
Instagram Ads Success! How To Run Successful Instagram Ads	https://www.udemy.com/instagram-ads-success-how-to-run-successful-instagram-ads/?couponCode=999IUNE20232	999IUNE20232
TailwindCSS from A to Z: Master TailwindCSS Quickly	https://www.udemy.com/learn-tailwind-css-quickly/?couponCode=87B44F1DA69BE3E9C242	87B44F1DA69BE3E9C242
AutoCAD 2023 MasterClass: Produce Amazing Site Plans Quickly	https://www.udemy.com/complete-autocad-for-beginners/?couponCode=4AF27689DA7F96462BAB	4AF27689DA7F96462BAB
WordPress Crash Course: Build any Website in Minutes!	https://www.udemy.com/wordpress-mastery-for-beginners-learn-wordpress-fast/?couponCode=D1BD7CD21356A8CB3072	D1BD7CD21356A8CB3072
Fixed Income Securities: Become a Bond Analyst & Investor	https://www.udemy.com/introduction-to-bonds/?couponCode=95946D561B6A55912490	95946D561B6A55912490
Time Management Mastery: 10X Your Time, Join the New Rich	https://www.udemy.com/time-management-secrets-of-billionaires/?couponCode=B904556BC2683E77CB45	B904556BC2683E77CB45
Complete Italian for Beginners: Speak Italian like a Pro	https://www.udemy.com/learn-easy-italian/?couponCode=07B3F5DE4C5593C0B354	07B3F5DE4C5593C0B354
Local SEO & Facebook Ads As Project & Fun: 10 Days Challenge	https://www.udemy.com/local-business-2022/?couponCode=RABBITJUNE2	RABBITJUNE2
Bootstrap 5 Course: Build Responsive Websites like a Pro	https://www.udemy.com/bootstrap5-website/?couponCode=36166A864FEF0564F926	36166A864FEF0564F926
Project Finance Fundamentals | Infrastructure & Energy	https://www.udemy.com/project-finance-fundamentals/?couponCode=1F11594977E037BEAB29	1F11594977E037BEAB29
Data Manipulation in Python: Master Python, Numpy & Pandas	https://www.udemy.com/master-data-science-in-python/?couponCode=CF1B39322E4476762AB1	CF1B39322E4476762AB1
Python for Deep Learning: Build Neural Networks in Python	https://www.udemy.com/deep-learning-basics-with-python/?couponCode=2AC8A5CE061B8708EFCB	2AC8A5CE061B8708EFCB
The Complete NFT Course: Become an NFT Creator & Investor	https://www.udemy.com/nft-for-beginners/?couponCode=9D5D010BDAA1F6327BFB	9D5D010BDAA1F6327BFB
Public Speaking for Women	https://www.udemy.com/public-speaking-for-women/?couponCode=THANKS027	THANKS027
Build a Shopify Store from Scratch: Lean Shopify from A to Z	https://www.udemy.com/build-a-shopify-store-from-scratch-lean-shopify-from-a-to-z/?couponCode=DAF46BE38C20474E8E51	DAF46BE38C20474E8E51
Project Finance & Excel: Build Financial Models from Scratch	https://www.udemy.com/project-finance-excel-build-financial-models-from-scratch/?couponCode=39A3DF5CA894BF019BF5	39A3DF5CA894BF019BF5
The Complete Vue.JS Course for Beginners: Zero to Mastery	https://www.udemy.com/the-complete-vuejs-course-for-beginners-zero-to-mastery/?couponCode=9BD7E18EFAFBA73AE226	9BD7E18EFAFBA73AE226
2023 Python for Linear Regression in Machine Learning	https://www.udemy.com/python-for-advanced-linear-regression-masterclass/?couponCode=21A5D9691279460C851E	21A5D9691279460C851E
2023 Advanced Machine Learning and Deep Learning Projects	https://www.udemy.com/advanced-natural-language-and-image-processing-projects/?couponCode=F3ED3AE494E2246C972C	F3ED3AE494E2246C972C
Introduction to Spacy for Natural Language Processing	https://www.udemy.com/introduction-to-for-natural-language-processing/?couponCode=2F11068F9A55346840B2	2F11068F9A55346840B2
2023 R 4.0 Programming for Data Science || Beginners to Pro	https://www.udemy.com/r-programming-for-data-science-beginners-to-pro/?couponCode=1C28A3F201CB928C8A6B	1C28A3F201CB928C8A6B
2023 Natural Language Processing in Python for Beginners	https://www.udemy.com/nlp-in-python/?couponCode=162BD84EBD8565F32BB8	162BD84EBD8565F32BB8
Deployment of Machine Learning Models in Production | Python	https://www.udemy.com/nlp-with-bert-in-python/?couponCode=24F6738CB70C8BEB0AF4	24F6738CB70C8BEB0AF4
Human Resource Management - HR Fundamentals 101 to Advanced	https://www.udemy.com/human-resource-management-hr-fundamentals-101-to-advanced/?couponCode=EDUCBA1	EDUCBA1
Run Multiple Sites on an Instance: Digital Ocean & Linode	https://www.udemy.com/run-multiple-sites-on-an-instance-digital-ocean-linode/?couponCode=YOUACCEL35296	YOUACCEL35296
Configure NGINX on a Cloud Server: Digital Ocean & AWS	https://www.udemy.com/configure-nginx-on-a-cloud-server-digital-ocean-aws/?couponCode=YOUACCEL31402	YOUACCEL31402
Linode: Build and Deploy Responsive Websites on the Cloud	https://www.udemy.com/linode-build-and-deploy-responsive-websites-on-the-cloud/?couponCode=YOUACCEL31402	YOUACCEL31402
Cloud Computing Essentials: Linode, Linux, and LAMP Stack	https://www.udemy.com/cloud-computing-essentials-linode-linux-and-lamp-stack/?couponCode=YOUACCEL31402	YOUACCEL31402
Introduction to Domain Names and Web Hosting - Quick Guide	https://www.udemy.com/introduction-to-domain-names-and-web-hosting-quick-guide/?couponCode=YOUACCEL31402	YOUACCEL31402
JavaScript, Bootstrap, & PHP - Certification for Beginners	https://www.udemy.com/javascript-bootstrap-php-certification-for-beginners/?couponCode=YOUACCEL31402	YOUACCEL31402
HTML, JavaScript, & Bootstrap - Certification Course	https://www.udemy.com/html-javascript-bootstrap-certification-course/?couponCode=YOUACCEL31402	YOUACCEL31402
PHP & MySQL - Certification Course for Beginners	https://www.udemy.com/php-mysql-certification-course-for-beginners/?couponCode=YOUACCEL31402	YOUACCEL31402
Learn Bootstrap - For Beginners	https://www.udemy.com/learn-bootstrap-for-beginners/?couponCode=YOUACCEL31402	YOUACCEL31402
Master Course : Quality Management & Stakeholder Management	https://www.udemy.com/quality-management-stakeholder-management-quality-control-iso-9001/?couponCode=5932E7A08DC5B5D43F8F	5932E7A08DC5B5D43F8F
Master Course in Cyber Security & Cyber Security Awareness	https://www.udemy.com/cyber-security-cyber-security-awareness-social-engineering/?couponCode=880AD40834539B00917C	880AD40834539B00917C
Bootstrap & jQuery - Certification Course for Beginners	https://www.udemy.com/bootstrap-jquery-certification-course-for-beginners/?couponCode=YOUACCEL35296	YOUACCEL35296
Internet & Cloud Computing Foundations	https://www.udemy.com/internet-cloud-computing-foundations/?couponCode=YOUACCEL35296	YOUACCEL35296
Create a Members Only Blog using PHP, MySQL, & AJAX	https://www.udemy.com/create-a-members-only-blog-using-php-mysql-ajax/?couponCode=YOUACCEL35296	YOUACCEL35296
How the Internet Works & the Web Development Process	https://www.udemy.com/how-the-internet-works-the-web-development-process/?couponCode=YOUACCEL35296	YOUACCEL35296
HTML & CSS - Certification Course for Beginners	https://www.udemy.com/html-css-certification-course-for-beginners/?couponCode=YOUACCEL35296	YOUACCEL35296
Linode: Foundations of Web Server Security	https://www.udemy.com/linode-foundations-of-web-server-security/?couponCode=YOUACCEL35296	YOUACCEL35296
AWS Beginner to Intermediate: EC2, IAM, ELB, ASG, Route 53	https://www.udemy.com/aws-beginner-to-intermediate-ec2-iam-elb-asg-route-53/?couponCode=YOUACCEL35296	YOUACCEL35296
Adobe Lightroom Classic CC: Master the Library Module	https://www.udemy.com/adobe-lightroom-classic-cc-master-the-library-module/?couponCode=YOUACCEL35296	YOUACCEL35296
Introduction to Forex- learn to trade forex by yourself	https://www.udemy.com/introduction-to-forex-learn-to-trade-forex-by-yourself/?couponCode=1C06BA768FFD778684C3	1C06BA768FFD778684C3
Microsoft Excel - Learn MS EXCEL For DATA Analysis	https://www.udemy.com/microsoft-excel-learn-ms-excel-for-data-analysis/?couponCode=E12671B15EA7C15ECA1E	E12671B15EA7C15ECA1E
WordPress Theme Development for Themeforest with Elementor	https://www.udemy.com/wordpress-theme-elementor-integration-for-themeforest/?couponCode=ELEMENTORTHEMING	ELEMENTORTHEMING
Learn How to Draw: Basic Drawing for Beginners	https://www.udemy.com/basicdrawing/?couponCode=E07532A2475FC9CD38A6	E07532A2475FC9CD38A6
Video Editing with Adobe Premiere Pro CC for Beginners	https://www.udemy.com/video-editing-with-adobe-premiere-pro-cc-for-beginners/?couponCode=E156DC2243FABC32F8F5	E156DC2243FABC32F8F5
Color Correction & Grading with Adobe Premiere Pro	https://www.udemy.com/color-correction-grading-with-adobe-premiere-pro/?couponCode=474B6D2493EC7888A370	474B6D2493EC7888A370
Learn Basics Of Adobe After Effects CC for Beginners	https://www.udemy.com/learn-basics-of-adobe-after-effects-cc-for-beginners-learn/?couponCode=5A95A1DB1EDBC2831F71	5A95A1DB1EDBC2831F71
Excel for Marketers	https://www.udemy.com/excel-guide/?couponCode=FREE2906	FREE2906
Adobe After Effects Basics	https://www.udemy.com/learn-basic-after-effects/?couponCode=FREE623G1S3	FREE623G1S3
Adobe After Effects Ultimate Guide	https://www.udemy.com/adobe-after-effects-cc-2020/?couponCode=FREE623G1S3	FREE623G1S3
Adobe Illustrator Basics	https://www.udemy.com/learn-basic-illustrator/?couponCode=FREE623G1S3	FREE623G1S3
Adobe Illustrator Ultimate Guide	https://www.udemy.com/adobe-illustrator-cc-2020-master-course/?couponCode=FREE623G1S3	FREE623G1S3
Adobe Photoshop App Design	https://www.udemy.com/learn-app-design-with-photoshop-2020/?couponCode=FREE623G1S3	FREE623G1S3
Podcasting made easy - your first podcast	https://www.udemy.com/podcasting-made-easy-your-first-podcast/?couponCode=SENDINGLOVE	SENDINGLOVE
Instagram Marketing 2021: Growth and Promotion on Instagram	https://www.udemy.com/instagram-marketing-2021-growth-and-promotion-on-instagram/?couponCode=9C3EA78C7B7A7F921C93	9C3EA78C7B7A7F921C93
Hands-On SQL Server,ManagementStudio,SQL Queries,AzureStudio	https://www.udemy.com/hands-on-sql-servermanagementstudiosql-queriesazurestudio/?couponCode=652FBABF434CA3EED374	652FBABF434CA3EED374
Robot Structural Analysis (Steel Structure)	https://www.udemy.com/autodesk-robot-steel-structure-modeling-analysis-and-design/?couponCode=97B677B42FE899DA7C73	97B677B42FE899DA7C73
Advanced ETABS V2019 52 stories Tower different seismic sys	https://www.udemy.com/advanced-etabs-v2019-52-stories-tower-different-seismic-sys/?couponCode=1F6A439B3C128F5D9F9C	1F6A439B3C128F5D9F9C
STAAD Pro V8 Structural design of R.C building from A to Z	https://www.udemy.com/staad-pro-v8-structural-design-of-rc-building-from-a-to-z/?couponCode=5BA582BEBC61915CED19	5BA582BEBC61915CED19
Tekla Structures shop drawing R.C.C Building	https://www.udemy.com/tekla-structures-shop-drawing-rcc-building/?couponCode=85466B019609F9120E2B	85466B019609F9120E2B
Civil Engineering Structural Shop Drawing in AutoCAD	https://www.udemy.com/civil-engineering-structural-shop-drawing-in-autocad/?couponCode=87D907805094A10FA34A	87D907805094A10FA34A
Tekla structures Shop drawings Steel Structure	https://www.udemy.com/tekla-steel-structure-modeling/?couponCode=1E288E34049A83503FF6	1E288E34049A83503FF6
ETABS v19 & SAFE v16 in Villa Structural Design in UAE+CAD	https://www.udemy.com/etabs-v19-safe-v16-in-villa-structural-design-in-uaecad/?couponCode=5D75E151BB9D5F439B69	5D75E151BB9D5F439B69
CSI ETABSV19 steel structure analysis and design	https://www.udemy.com/csi-etabsv19-steel-structure-analysis-and-design/?couponCode=ADCE139B01F8EDCC2EA7	ADCE139B01F8EDCC2EA7
AutoCAD2020 2D Basics & Advanced(Full Projects Civil + Arch)	https://www.udemy.com/autocad2020-basics-advancedfull-projects-civil-and-arch/?couponCode=82D53D95FF3C049E07DC	82D53D95FF3C049E07DC
Architectural Shop Drawing Plans in AutoCAD 2020	https://www.udemy.com/architectural-shop-drawing-plans-in-autocad-2020/?couponCode=3BFF3DA2E897021E0DD8	3BFF3DA2E897021E0DD8
STAAD Pro V8 Industrial Steel Warehouse Design from A to Z	https://www.udemy.com/staad-pro-v8-industrial-steel-warehouse-design-from-a-to-z/?couponCode=E32BC59D3658010E115D	E32BC59D3658010E115D
Prokon Analysis and Design of 3 Stories R.C.C Building	https://www.udemy.com/prokon-analysis-and-design-of-3-stories-rcc-building/?couponCode=6D812123502B9C37A738	6D812123502B9C37A738
Autodesk Structural Robot R.C.C Villa Design in UAE	https://www.udemy.com/autodesk-structural-robot-rcc-villa-design-in-uae/?couponCode=D7A88FDECF84240A112F	D7A88FDECF84240A112F
Prokon Civil Engineering Structural Design R.C.C Element	https://www.udemy.com/prokon-civil-engineering-structural-design-rcc-element/?couponCode=71DEC37D4D54887E7067	71DEC37D4D54887E7067
ETABS & Safe in 11m Span Slab without Cracked Of Glass Walls	https://www.udemy.com/etabs-safe-in-11m-span-slab-without-cracked-of-glass-walls/?couponCode=E2B151055688FDFC8BE8	E2B151055688FDFC8BE8
ETABS & Safe in R.C.C 3m Cantilever Project without cracked	https://www.udemy.com/etabs-safe-in-rcc-3m-cantilever-project-without-cracked/?couponCode=1552C6E93E19661988F1	1552C6E93E19661988F1
CSI Sap2000 3D building design + all type of (Stairs+Tanks)	https://www.udemy.com/csi-sap2000-3d-building-design-all-type-of-stairstanks/?couponCode=70AD1D6D269F07302D60	70AD1D6D269F07302D60
Csi ETABS in the Structural analysis of 15 stories+ basement	https://www.udemy.com/csi-etabs-in-the-structural-analysis-of-15-stories-basement/?couponCode=0B403E56E931F4E695E9	0B403E56E931F4E695E9
Revit structural drawing of 15 stories residential building	https://www.udemy.com/revit-structural-drawing-of-15-stories-residential-building/?couponCode=C98DA81409B0DDF769C4	C98DA81409B0DDF769C4
Robot structural design 15 stories residential buildings	https://www.udemy.com/robot-structural-design-15-stories-residential-buildings/?couponCode=513D9FD1889DBA8D5801	513D9FD1889DBA8D5801
Csi Safe + AllPile foundation, slabs, beams and deflection	https://www.udemy.com/csi-safe-allpile-foundation-slabs-beams-and-deflection/?couponCode=A757843474A23F0121F4	A757843474A23F0121F4
Autodesk Revit & Robot Structural Analysis + Sheets + BOQ	https://www.udemy.com/autodesk-revit-robot-building-design-sheets-boq/?couponCode=0EDC207177AAE0B365A9	0EDC207177AAE0B365A9
Learn ETABS & SAFE in the Structural Design of 15 Stories RC	https://www.udemy.com/learn-etabs-safe-in-the-structural-design-of-15-stories-rc/?couponCode=931FA2082C0281E1CCFE	931FA2082C0281E1CCFE
Being a Voice Artist - Practical Tips to Start	https://www.udemy.com/being-a-voice-artist-practical-tips-to-start/?couponCode=77162495D0E61990BA3A	77162495D0E61990BA3A
New German Medicine	https://www.udemy.com/new-german-medicine/?couponCode=75E3B1AC4351EA5392AA	75E3B1AC4351EA5392AA
Sell More: Facebook Ads & Instagram Ads for E-Commerce 2023	https://www.udemy.com/facebook-conversion-ads/?couponCode=RABBITJUNE2	RABBITJUNE2
Ethics of Research-A Basic Course	https://www.udemy.com/ethics-of-research/?couponCode=ETHIC_FREE_623	ETHIC_FREE_623
Car Flipping : The Art of Car Business in 90 Minute ! |2023+	https://www.udemy.com/car-flipping-earn-money-from-selling-used-cars-ocsaly/?couponCode=BEST_COURSE	BEST_COURSE
Become 100% Confident RPA UiPath Developer- Build 8 Projects	https://www.udemy.com/go-from-zero-to-hero-build-rpa-uipath-projects-from-scratch/?couponCode=2A30FA4B9C651DCBE4E5	2A30FA4B9C651DCBE4E5
Facebook & Instagram Dynamic Ads: Dynamic Retargeting Course	https://www.udemy.com/facebook-dynamic-ads/?couponCode=LUCKYWATERRABBIT1	LUCKYWATERRABBIT1
Alteryx Micro Credential Exam Preparation-November 2022	https://www.udemy.com/alteryx-micro-credential-exam-preparation/?couponCode=5229DC0301A1D7967CA0	5229DC0301A1D7967CA0
Google My Business. How to Master Powerful Tool for Company	https://www.udemy.com/google-my-business-how-to-master-powerful-tool-for-company/?couponCode=GMB2706	GMB2706
Create a WordPress website with Hostinger!	https://www.udemy.com/wordpress-and-hosting-for-beginners/?couponCode=WP2706	WP2706
Build Your Best Cold Email Strategy!	https://www.udemy.com/cold-marketing-strategy/?couponCode=COLD2706	COLD2706
Account Based Marketing - ABM: Increase Your B2B Efficiency	https://www.udemy.com/account-based-marketing-increase-your-b2b-efficiency/?couponCode=ABM2706	ABM2706
Master Course in Corporate Governance and IT Governance 2.0	https://www.udemy.com/corporate-governance-it-governance-stakeholders-management/?couponCode=BCA7D67AB8657CE9DB27	BCA7D67AB8657CE9DB27
Master Course in Fleet Management and Freight Broker 3.0	https://www.udemy.com/fleet-management-freight-broker-freight-forwarder-fleet-manager/?couponCode=7595B1182D06E3772A74	7595B1182D06E3772A74
Oracle Primavera P6 Essentials Training	https://www.udemy.com/project-schedule-management-oracle-primavera-p6-foundations-training/?couponCode=E0705BBE4B7D1C52B090	E0705BBE4B7D1C52B090
Google Analytics, GTM. How to improve your marketing?	https://www.udemy.com/google-analytics-ga4-gtm-for-beginners/?couponCode=GAFREE2606	GAFREE2606
Master Online Events! Virtual Audience Engagement Tools 2023	https://www.udemy.com/better-online-meetings-virtual-audience-engagement-tools/?couponCode=2023EVENT	2023EVENT
How To Maximize Your Profits Trading Options	https://www.udemy.com/how-to-maximize-your-profits-trading-options/?couponCode=MAXJUNE2	MAXJUNE2
Trading Options for Weekly Income	https://www.udemy.com/trading-options-for-weekly-income/?couponCode=WEEKJUNE3	WEEKJUNE3
Trading Butterfly Spreads for Income	https://www.udemy.com/butterfly-spreads/?couponCode=FLYJUNE2	FLYJUNE2
Day Trading Options for Income	https://www.udemy.com/mighty-ninety/?couponCode=JUNEDT3	JUNEDT3
Creative Infographics in PowerPoint	https://www.udemy.com/creative-infographics-in-powerpoint/?couponCode=INFOGR_JUN23_3	INFOGR_JUN23_3
Creating Video Lessons with Online Video Maker InVideo	https://www.udemy.com/video-lecture-with-neitdesign-for-invideo/?couponCode=INVIDEO_JUNE23_3	INVIDEO_JUNE23_3
The Complete Persian Language Course	https://www.udemy.com/persian-language-course/?couponCode=BDA31A43F1FD263BAF80	BDA31A43F1FD263BAF80
